id,discussionId,userId,questionText,createdAt
716,222,514,Occaecati tutis sapiente ait quas bonus sufficio benevolentia confugo.?,2024-10-09 06:04:27.445
719,222,528,Totidem defero surculus vorago ventito curtus.?,2024-10-09 06:04:27.465
725,223,668,Tunc amplus id adflicto appono.?,2024-10-09 06:04:27.490
729,224,553,Cura illo torqueo strues vulgo.?,2024-10-09 06:04:27.504
731,225,651,Dolorum suadeo aperiam vicinus.?,2024-10-09 06:04:27.511
733,225,556,Tutamen degusto modi eos vindico agnitio censura.?,2024-10-09 06:04:27.516
734,225,642,Degusto carmen adstringo video vigilo virgo.?,2024-10-09 06:04:27.519
737,226,621,Comprehendo antepono templum amo absum vapulus conduco xiphias.?,2024-10-09 06:04:27.530
746,228,628,Averto utique tener cibo cumque adficio consectetur.?,2024-10-09 06:04:27.564
751,229,644,Unde venustas vilis abutor officiis.?,2024-10-09 06:04:27.585
753,229,554,Aliqua clibanus maiores balbus vestrum sum carbo facilis.?,2024-10-09 06:04:27.593
756,230,521,Soleo dolore tribuo stips tamquam considero hic culpa.?,2024-10-09 06:04:27.606
761,231,596,Amitto celo concedo assumenda cribro terror.?,2024-10-09 06:04:27.626
770,232,537,Trucido caelum tabgo versus concido libero bonus.?,2024-10-09 06:04:27.656
776,234,537,Stultus coepi sponte super.?,2024-10-09 06:04:27.680
779,234,674,Cui tam tepesco accendo trans casso taceo facilis.?,2024-10-09 06:04:27.701
784,235,652,Thalassinus aggero commodo crudelis cruciamentum curso.?,2024-10-09 06:04:27.721
786,236,600,Tepesco animi balbus auditor vorax iusto.?,2024-10-09 06:04:27.730
792,237,694,Cura expedita corrumpo tabernus.?,2024-10-09 06:04:27.751
795,237,561,Tui non casso deleo aliquam ara subvenio cimentarius tondeo.?,2024-10-09 06:04:27.758
800,238,586,Attonbitus assentator pecco.?,2024-10-09 06:04:27.778
804,239,515,Delectus alii arca templum spectaculum ciminatio sto.?,2024-10-09 06:04:27.790
806,240,541,Uterque caries umquam soleo subnecto.?,2024-10-09 06:04:27.797
815,241,545,Aggredior sublime caveo demitto.?,2024-10-09 06:04:27.826
816,242,646,Excepturi quas auxilium adaugeo audacia abbas atrox.?,2024-10-09 06:04:27.830
823,243,676,Dignissimos tabula autem architecto id natus assumenda cui spectaculum.?,2024-10-09 06:04:27.850
835,245,697,Adsuesco facilis atque comminor terra terror cogito tandem adulescens super.?,2024-10-09 06:04:27.886
841,247,624,Bestia acer confugo amo viriliter vinco absorbeo vinco.?,2024-10-09 06:04:27.903
844,247,546,Coniecto utrum aggero conforto angelus adinventitias minus claro.?,2024-10-09 06:04:27.911
846,248,538,Volaticus deporto inventore tempore paulatim sed arma abbas solum.?,2024-10-09 06:04:27.917
848,248,602,Asperiores reprehenderit vigor deprimo tolero villa crastinus.?,2024-10-09 06:04:27.922
852,249,575,Ulterius caterva patrocinor.?,2024-10-09 06:04:27.937
857,250,640,Arbitro conatus itaque vito curto theca curvo sint.?,2024-10-09 06:04:27.950
859,250,626,Suasoria utrum conspergo suadeo corporis culpa.?,2024-10-09 06:04:27.955
861,251,612,Templum accendo vesper trucido vesco verto vulgivagus quia.?,2024-10-09 06:04:27.961
867,252,687,Torrens tondeo patruus dolor vindico culpa arcesso astrum vomer.?,2024-10-09 06:04:27.981
870,252,678,Soluta termes suffoco valeo arca appono conicio cenaculum repellat denuncio.?,2024-10-09 06:04:27.996
872,253,619,Valetudo dicta vitiosus quasi audax atavus cras.?,2024-10-09 06:04:28.001
874,253,673,Ventito vere crinis.?,2024-10-09 06:04:28.006
877,254,610,Calco alii stabilis consectetur vere commemoro triumphus.?,2024-10-09 06:04:28.019
878,254,625,Ducimus reiciendis angustus.?,2024-10-09 06:04:28.022
879,254,575,Subiungo adduco temporibus ventosus delectatio benigne celer tui cupressus.?,2024-10-09 06:04:28.025
880,254,554,Vitiosus enim corrigo ustilo aqua sordeo damnatio non.?,2024-10-09 06:04:28.028
885,255,566,Valens conicio at agnitio combibo deprecator.?,2024-10-09 06:04:28.044
886,256,634,Recusandae canto comburo.?,2024-10-09 06:04:28.048
890,256,537,Credo minus curia admoveo neque bis testimonium spero depromo aeternus.?,2024-10-09 06:04:28.062
891,257,517,Succurro ab corporis ab pecus minima amet repellendus damnatio.?,2024-10-09 06:04:28.066
893,257,686,Animi vito alo impedit ventus tertius addo.?,2024-10-09 06:04:28.072
894,257,682,Clam tergeo temptatio arma stips.?,2024-10-09 06:04:28.075
896,258,509,Curia bellicus aeger cogito audentia textilis annus asper uredo.?,2024-10-09 06:04:28.085
897,258,640,Libero vigor eligendi deprecator tabernus decet viridis alii.?,2024-10-09 06:04:28.089
898,258,664,Caput usque sustineo celo paens decipio bardus error reprehenderit usitas.?,2024-10-09 06:04:28.093
909,260,596,Maxime sunt pauper textor.?,2024-10-09 06:04:28.138
913,261,551,Desino vulticulus catena testimonium aggero trans agnitio eveniet.?,2024-10-09 06:04:28.151
917,262,564,Tergeo itaque tantillus laboriosam conduco dolore.?,2024-10-09 06:04:28.163
920,262,546,Ex collum consuasor conitor theca ullus fuga vinum.?,2024-10-09 06:04:28.176
921,263,538,Teres speciosus acervus thesaurus curo.?,2024-10-09 06:04:28.180
923,263,520,Vilicus torrens eos.?,2024-10-09 06:04:28.185
926,264,636,Sopor cado corrigo.?,2024-10-09 06:04:28.195
927,264,601,Benevolentia admoveo cognatus timidus quia paens cupressus.?,2024-10-09 06:04:28.198
932,265,564,Concido concido absconditus sulum brevis verus causa aegrotatio degusto deprimo.?,2024-10-09 06:04:28.217
937,266,577,Complectus cui arbor.?,2024-10-09 06:04:28.233
941,267,629,Sperno tabesco delectus verbera.?,2024-10-09 06:04:28.246
943,267,702,Argentum stipes attero sponte provident trepide contabesco studio avarus consequuntur.?,2024-10-09 06:04:28.252
944,267,540,Tabesco amiculum benevolentia.?,2024-10-09 06:04:28.255
947,268,650,Desolo suffragium spes ago voluptatibus charisma vulgus fuga deludo.?,2024-10-09 06:04:28.266
949,268,624,Speciosus desparatus vita arx tremo alius copia sapiente cometes.?,2024-10-09 06:04:28.277
950,268,570,Amplus accusamus depono nobis.?,2024-10-09 06:04:28.280
952,269,594,Tolero suscipit aestus tricesimus torrens deserunt amissio tyrannus.?,2024-10-09 06:04:28.287
955,269,589,Deporto animadverto civis audeo contra combibo tribuo praesentium suscipio voveo.?,2024-10-09 06:04:28.298
958,270,634,Color decor cohors.?,2024-10-09 06:04:28.309
961,271,589,Abbas unde rem clamo urbanus voveo sumo.?,2024-10-09 06:04:28.319
970,272,556,Aggredior desolo condico optio contigo sulum accusator cernuus.?,2024-10-09 06:04:28.346
973,273,541,Sub optio vitae arcus amitto comminor vester candidus.?,2024-10-09 06:04:28.357
974,273,637,Decet patria cuppedia crudelis adnuo theologus.?,2024-10-09 06:04:28.360
976,274,601,Subito vulgo nostrum libero ipsa thymbra laborum cur.?,2024-10-09 06:04:28.366
978,274,608,Utique sed veniam sunt suasoria cohaero cimentarius tunc thermae animi.?,2024-10-09 06:04:28.370
980,274,632,Tego repellendus arto cauda tamen depraedor aeger benigne demum aut.?,2024-10-09 06:04:28.377
717,222,540,Aptus reiciendis voro expedita compono.?,2024-10-09 06:04:27.454
721,223,544,Torqueo voluptates aureus solvo advoco qui spero vae.?,2024-10-09 06:04:27.475
722,223,636,Cena laudantium eveniet vulticulus antea centum.?,2024-10-09 06:04:27.480
724,223,627,Artificiose coma triduana summopere tutis occaecati vindico suffoco tamquam templum.?,2024-10-09 06:04:27.486
726,224,652,Astrum vereor concido.?,2024-10-09 06:04:27.495
727,224,680,Capto territo confugo varius absens despecto vigor approbo.?,2024-10-09 06:04:27.498
730,224,613,Vereor adhaero voluptatum tracto ullam utique qui ascit tot varietas.?,2024-10-09 06:04:27.507
732,225,537,Curso trucido deludo vita video villa.?,2024-10-09 06:04:27.514
736,226,554,Canis nulla animi demonstro.?,2024-10-09 06:04:27.526
738,226,582,Suscipio argumentum adsidue abstergo decor adulescens suscipio unus.?,2024-10-09 06:04:27.533
739,226,516,Colo aut voluptatibus temptatio sed terror adfectus tactus cruentus bos.?,2024-10-09 06:04:27.535
743,227,527,Numquam deinde tergiversatio minus totidem aegrotatio natus adversus triumphus canto.?,2024-10-09 06:04:27.552
750,228,697,Adnuo assumenda ver villa fugiat.?,2024-10-09 06:04:27.578
759,230,675,Turpis absens ocer crebro sed.?,2024-10-09 06:04:27.618
760,230,596,Caritas trado abeo velociter sui vel infit molestias ulciscor apparatus.?,2024-10-09 06:04:27.621
765,231,607,Desparatus vapulus alter vesica comitatus.?,2024-10-09 06:04:27.638
768,232,605,Coerceo acer coniuratio conspergo absque conqueror solvo.?,2024-10-09 06:04:27.649
771,233,557,Toties labore cuppedia carmen ambulo deleo delego.?,2024-10-09 06:04:27.660
772,233,534,Verecundia tripudio calco tres.?,2024-10-09 06:04:27.666
773,233,558,Patria corrumpo ab cilicium eius solio.?,2024-10-09 06:04:27.668
775,233,581,Voluptate sui bellum commodo accusator conduco attollo rem caelum.?,2024-10-09 06:04:27.674
777,234,531,Constans tam celo cotidie soluta.?,2024-10-09 06:04:27.695
780,234,566,Dolore quia desidero.?,2024-10-09 06:04:27.705
783,235,592,Demum vix celo verbera volva charisma victoria utor audio universe.?,2024-10-09 06:04:27.718
789,236,536,Eius suadeo pauci aliqua.?,2024-10-09 06:04:27.741
790,236,592,Facilis pel numquam cultura vae vorax votum laudantium ager defluo.?,2024-10-09 06:04:27.744
794,237,675,Stipes titulus amiculum accusamus tunc desparatus.?,2024-10-09 06:04:27.756
799,238,553,Vinitor admoneo subvenio ducimus advenio supra advoco.?,2024-10-09 06:04:27.775
802,239,529,Tabula totidem nostrum incidunt beatus pecco aduro ipsum.?,2024-10-09 06:04:27.785
807,240,564,Incidunt infit una allatus consectetur adsuesco.?,2024-10-09 06:04:27.800
809,240,672,Coaegresco soleo quisquam esse appono.?,2024-10-09 06:04:27.806
810,240,513,Vulgivagus deleo eius thesis votum uter caste addo civitas.?,2024-10-09 06:04:27.809
811,241,524,Voluntarius pax amaritudo tergeo uter umerus sto capto.?,2024-10-09 06:04:27.814
812,241,684,Vulnus amoveo amplus cimentarius vigor.?,2024-10-09 06:04:27.817
814,241,579,Concido timidus angulus corporis alius perferendis contra stabilis.?,2024-10-09 06:04:27.823
818,242,626,Doloremque accusamus tempora sapiente absum aetas deserunt abstergo placeat.?,2024-10-09 06:04:27.836
819,242,692,Audax callide ager.?,2024-10-09 06:04:27.838
821,243,574,Astrum vado carus antiquus sopor pel compono turpis.?,2024-10-09 06:04:27.845
824,243,667,Bibo minus contabesco vox aureus ipsam verbera conitor.?,2024-10-09 06:04:27.855
825,243,511,Doloremque bestia textus adhuc cognomen abeo approbo cupiditas.?,2024-10-09 06:04:27.857
826,244,577,Benigne delibero venio supra caelestis degusto addo agnitio in virgo.?,2024-10-09 06:04:27.862
827,244,533,Deorsum suggero decipio congregatio alii debitis.?,2024-10-09 06:04:27.864
829,244,613,Architecto copiose audentia sollicito adicio ara.?,2024-10-09 06:04:27.869
831,245,557,Vulnero surgo defaeco.?,2024-10-09 06:04:27.875
833,245,535,Artificiose repudiandae cinis vesco spiculum conturbo annus tristis.?,2024-10-09 06:04:27.881
836,246,528,Damnatio succedo circumvenio subvenio abscido contabesco benevolentia paens summopere concido.?,2024-10-09 06:04:27.889
838,246,601,Alveus viscus deputo exercitationem summa torqueo.?,2024-10-09 06:04:27.894
839,246,551,Neque video amiculum una abscido corpus.?,2024-10-09 06:04:27.897
842,247,638,Repudiandae vado spes chirographum utor.?,2024-10-09 06:04:27.905
847,248,609,Speciosus sumptus ancilla conor.?,2024-10-09 06:04:27.920
849,248,663,Texo non doloremque benigne.?,2024-10-09 06:04:27.925
850,248,509,Avaritia taedium talio ascisco spiritus vicinus absorbeo.?,2024-10-09 06:04:27.931
851,249,598,Aggredior curis decor appositus.?,2024-10-09 06:04:27.935
854,249,538,Eaque tergum deputo absorbeo comminor.?,2024-10-09 06:04:27.942
858,250,679,Communis adipiscor comitatus itaque adulatio.?,2024-10-09 06:04:27.953
860,250,674,Arguo uterque tergeo deficio auxilium neque.?,2024-10-09 06:04:27.958
862,251,624,Labore coadunatio substantia comminor adulescens.?,2024-10-09 06:04:27.964
863,251,514,Trans vespillo vehemens ait thorax vehemens arceo alienus volaticus.?,2024-10-09 06:04:27.968
864,251,650,Vilitas perspiciatis trado arbustum sum ambitus spiritus usque.?,2024-10-09 06:04:27.971
865,251,519,Velociter crebro tibi condico.?,2024-10-09 06:04:27.974
866,252,670,Accusamus laudantium beatus vulticulus nostrum cubitum terebro crudelis.?,2024-10-09 06:04:27.978
868,252,555,Solutio sordeo voluptatum acsi.?,2024-10-09 06:04:27.983
869,252,578,Tendo colligo aestas vinculum turpis arbustum delectatio cum libero varietas.?,2024-10-09 06:04:27.993
871,253,685,Necessitatibus suadeo alter.?,2024-10-09 06:04:27.999
873,253,582,Vita ager tego vesica adsuesco abeo.?,2024-10-09 06:04:28.004
875,253,526,Testimonium vilitas ars.?,2024-10-09 06:04:28.009
884,255,602,Defendo pecus occaecati absorbeo varius depopulo.?,2024-10-09 06:04:28.041
888,256,624,Venustas vilicus campana recusandae copia summisse tondeo abduco.?,2024-10-09 06:04:28.054
889,256,638,Torqueo thesis carmen.?,2024-10-09 06:04:28.057
892,257,655,Sui venia curia volup id vel cohibeo aeneus.?,2024-10-09 06:04:28.069
899,258,547,Denique decumbo vesper.?,2024-10-09 06:04:28.097
901,259,555,Virga voco antiquus.?,2024-10-09 06:04:28.104
904,259,676,Cras aurum curto vigilo utroque.?,2024-10-09 06:04:28.113
905,259,546,Copia victus color strues.?,2024-10-09 06:04:28.116
907,260,609,Eum supplanto teneo labore depopulo utrum.?,2024-10-09 06:04:28.122
908,260,523,Sol spectaculum vitium tot suspendo charisma provident verumtamen quod tyrannus.?,2024-10-09 06:04:28.136
910,260,692,Pax sopor bonus sint.?,2024-10-09 06:04:28.141
912,261,560,Trepide astrum inventore.?,2024-10-09 06:04:28.148
914,261,526,Blanditiis absque synagoga solutio.?,2024-10-09 06:04:28.153
915,261,635,Aspicio avaritia corrupti assentator deripio cervus.?,2024-10-09 06:04:28.156
718,222,580,Supplanto demulceo turba conqueror.?,2024-10-09 06:04:27.460
720,222,675,Adulatio volva cauda.?,2024-10-09 06:04:27.468
723,223,638,Convoco tardus turba tergo angustus arca temeritas cilicium antepono.?,2024-10-09 06:04:27.483
728,224,683,Volup aureus tego ater deleniti fugiat reprehenderit solitudo deorsum.?,2024-10-09 06:04:27.501
735,225,573,Abundans beneficium spectaculum suscipit iste claro bonus.?,2024-10-09 06:04:27.522
740,226,593,Atavus aspernatur defungo ademptio avaritia theca taceo.?,2024-10-09 06:04:27.538
741,227,525,Terreo subseco tui pectus brevis claro.?,2024-10-09 06:04:27.544
742,227,647,Spes abundans maxime at.?,2024-10-09 06:04:27.548
744,227,618,Basium turbo dedecor labore ut somnus.?,2024-10-09 06:04:27.555
745,227,628,Tracto nemo territo tepesco stipes valetudo allatus sum.?,2024-10-09 06:04:27.557
747,228,577,Subnecto truculenter debilito curo.?,2024-10-09 06:04:27.567
748,228,667,Reprehenderit caritas socius sub teneo conqueror utrimque.?,2024-10-09 06:04:27.571
749,228,534,Amplus strenuus blanditiis synagoga eos.?,2024-10-09 06:04:27.574
752,229,656,Voluntarius voluptate explicabo tendo unde ipsa maiores ullus curis.?,2024-10-09 06:04:27.588
754,229,511,Aliquam aestas deserunt cum.?,2024-10-09 06:04:27.596
755,229,616,Amiculum cado arceo illo alo.?,2024-10-09 06:04:27.601
757,230,556,Benigne nesciunt ars eius caries callide vetus.?,2024-10-09 06:04:27.612
758,230,549,Desino blanditiis uterque.?,2024-10-09 06:04:27.615
762,231,681,Sublime abduco adipiscor absum cur thymum thesaurus cumque peior.?,2024-10-09 06:04:27.630
763,231,546,Delicate vereor communis sub utique nesciunt perferendis tutis in solio.?,2024-10-09 06:04:27.632
764,231,646,Voveo amitto pax.?,2024-10-09 06:04:27.635
766,232,557,Ex vilicus cuius fugiat civitas.?,2024-10-09 06:04:27.643
767,232,538,Coruscus ad beatae.?,2024-10-09 06:04:27.646
769,232,650,Capillus subvenio congregatio tabella decretum deduco vestrum.?,2024-10-09 06:04:27.653
774,233,572,Aveho subiungo quidem cultura advoco umquam caelestis.?,2024-10-09 06:04:27.671
778,234,610,Bellum ipsum aggredior denique sustineo corrigo.?,2024-10-09 06:04:27.698
781,235,665,Capto alii sit creo adduco turba tredecim soluta.?,2024-10-09 06:04:27.712
782,235,550,Harum placeat cruentus terreo arguo delinquo.?,2024-10-09 06:04:27.715
785,235,637,Cerno cuppedia urbs uberrime ultio tempora.?,2024-10-09 06:04:27.724
787,236,609,Virga ancilla coniecto.?,2024-10-09 06:04:27.733
788,236,696,Patria at adulatio.?,2024-10-09 06:04:27.736
791,237,591,Verto cultellus voluptatum antea.?,2024-10-09 06:04:27.748
793,237,593,Ambulo credo aut corporis super.?,2024-10-09 06:04:27.753
796,238,636,Asporto caveo qui approbo vesper ante vae animadverto qui.?,2024-10-09 06:04:27.763
797,238,521,Vulariter volup quaerat blandior patruus arx administratio degero statim.?,2024-10-09 06:04:27.766
798,238,572,Corpus conduco alius absconditus comitatus trans sublime.?,2024-10-09 06:04:27.772
801,239,665,Tego ullam peccatus conculco subnecto.?,2024-10-09 06:04:27.782
803,239,670,Sum tolero demergo comitatus stella virtus curatio vigilo terror voluptates.?,2024-10-09 06:04:27.787
805,239,599,Depraedor bis aureus annus statua cornu veritatis.?,2024-10-09 06:04:27.793
808,240,707,Quasi vigor currus.?,2024-10-09 06:04:27.803
813,241,518,Utpote adsuesco suppellex nostrum umbra dedico velociter.?,2024-10-09 06:04:27.820
817,242,518,Damno repudiandae desparatus sto.?,2024-10-09 06:04:27.833
820,242,610,Summisse succedo summisse alias vesper cogito.?,2024-10-09 06:04:27.841
822,243,655,Antepono aspernatur antea vestigium vilicus alienus demergo ducimus venustas.?,2024-10-09 06:04:27.847
828,244,600,Admiratio derideo teres coniecto tantillus vito.?,2024-10-09 06:04:27.867
830,244,552,Cultura cerno nam absum iste cetera doloremque audentia.?,2024-10-09 06:04:27.872
832,245,538,Dignissimos adnuo tepidus summopere celo clibanus.?,2024-10-09 06:04:27.878
834,245,624,Atavus dicta tenetur depereo a.?,2024-10-09 06:04:27.883
837,246,546,Corporis atrox voluptate eos paulatim templum colo.?,2024-10-09 06:04:27.892
840,246,654,Absconditus arca canto studio quas cado vulgivagus summisse tracto.?,2024-10-09 06:04:27.899
843,247,595,Thymum sol conforto complectus aureus.?,2024-10-09 06:04:27.908
845,247,702,Crapula cumque cognatus a tertius assumenda terra.?,2024-10-09 06:04:27.914
853,249,694,Curvo aperiam modi ubi volo thalassinus depulso bibo peior celer.?,2024-10-09 06:04:27.939
855,249,595,Tres claudeo arca tantillus caritas.?,2024-10-09 06:04:27.944
856,250,632,Velut cunctatio speciosus texo cresco decumbo acerbitas sollers illum vilitas.?,2024-10-09 06:04:27.948
876,254,691,Consequatur absens non odio debitis odio taedium tabgo aut vos.?,2024-10-09 06:04:28.016
881,255,643,Aeneus valetudo doloribus omnis dapifer reprehenderit conduco carpo crustulum.?,2024-10-09 06:04:28.033
882,255,515,Uxor harum suppono demoror umerus vito tertius benevolentia.?,2024-10-09 06:04:28.035
883,255,578,Velit valetudo tandem sodalitas.?,2024-10-09 06:04:28.038
887,256,687,Commemoro usitas ad.?,2024-10-09 06:04:28.051
895,257,708,Utrum patria vos patior.?,2024-10-09 06:04:28.079
900,258,662,Teres suppono uter cui ademptio.?,2024-10-09 06:04:28.100
902,259,575,Tredecim solitudo demum pauper cunctatio arx maiores arceo vos.?,2024-10-09 06:04:28.108
903,259,670,Ex curiositas teneo comedo.?,2024-10-09 06:04:28.111
906,260,615,Vulnero copiose conspergo consequuntur.?,2024-10-09 06:04:28.120
911,261,628,Vulnus amaritudo voveo voluptas.?,2024-10-09 06:04:28.146
916,262,609,Tyrannus ex pax.?,2024-10-09 06:04:28.160
918,262,667,Temptatio debeo derelinquo amitto.?,2024-10-09 06:04:28.167
924,263,618,Demoror vacuus tremo cultellus aperiam audentia sumo.?,2024-10-09 06:04:28.188
928,264,599,Vester tumultus vomer cinis tero conventus convoco cerno.?,2024-10-09 06:04:28.203
929,264,701,Pecto cunctatio clarus crinis volup vesica delicate aliquid vaco.?,2024-10-09 06:04:28.207
931,265,672,Conqueror quisquam repellat vociferor tabgo acquiro uterque coepi.?,2024-10-09 06:04:28.214
934,265,634,Quae thermae amo sodalitas.?,2024-10-09 06:04:28.223
936,266,616,Spes cornu iusto cultellus amor celo ipsa ver.?,2024-10-09 06:04:28.230
938,266,663,Tremo custodia cunabula arbustum conturbo anser thesaurus demonstro.?,2024-10-09 06:04:28.236
946,268,538,Casus sponte distinctio.?,2024-10-09 06:04:28.262
951,269,686,Decretum volaticus umquam comes balbus accusamus agnitio ipsa.?,2024-10-09 06:04:28.283
953,269,604,Ultra cubo defendo administratio.?,2024-10-09 06:04:28.290
956,270,522,Sapiente pecco vesco vulariter arma.?,2024-10-09 06:04:28.303
959,270,698,Eius astrum voluptatem expedita doloremque depraedor debeo vicinus soluta antea.?,2024-10-09 06:04:28.312
960,270,654,Solitudo cogo video animi velociter ipsum.?,2024-10-09 06:04:28.316
962,271,563,Aegrotatio succedo aer.?,2024-10-09 06:04:28.322
919,262,536,Acer votum basium sui tantum trepide crepusculum trucido bellicus trucido.?,2024-10-09 06:04:28.173
922,263,599,Vallum dolore provident comprehendo conforto vilis suscipit virtus adhaero.?,2024-10-09 06:04:28.183
925,263,543,Audax aestus vomica colo supra celo.?,2024-10-09 06:04:28.191
930,264,595,Advoco ter theca color summisse provident aeneus tergo demulceo.?,2024-10-09 06:04:28.210
933,265,575,Aegrotatio ceno defungo caute neque compello delicate adduco vinum quidem.?,2024-10-09 06:04:28.220
935,265,514,Audax commodo curis allatus antepono.?,2024-10-09 06:04:28.226
939,266,573,Delicate virtus architecto suadeo comparo.?,2024-10-09 06:04:28.239
940,266,546,Cui caput ullus admoveo dolorem undique.?,2024-10-09 06:04:28.242
942,267,670,Versus decerno quod.?,2024-10-09 06:04:28.249
945,267,535,Angustus cavus impedit tamisium clibanus tredecim vinum caute.?,2024-10-09 06:04:28.258
948,268,543,Sulum alo vir.?,2024-10-09 06:04:28.274
954,269,691,Defaeco supplanto placeat alioqui.?,2024-10-09 06:04:28.295
957,270,606,Volutabrum illo sum talis.?,2024-10-09 06:04:28.306
963,271,641,Impedit arbustum vacuus laudantium utrum spero.?,2024-10-09 06:04:28.325
965,271,643,Stillicidium triumphus volutabrum appello.?,2024-10-09 06:04:28.331
967,272,566,Aro demergo unde.?,2024-10-09 06:04:28.338
969,272,630,Defluo solus caste thorax.?,2024-10-09 06:04:28.343
982,275,621,Surgo conitor adsuesco tersus comburo.?,2024-10-09 06:04:28.384
985,275,687,Supra bellicus conspergo unde iusto comparo cedo conduco.?,2024-10-09 06:04:28.392
989,276,700,Acidus denuncio cui paulatim comes crinis ars voluptatum.?,2024-10-09 06:04:28.407
992,277,657,Spectaculum admoveo cometes vir depromo assumenda.?,2024-10-09 06:04:28.416
993,277,584,Illo absorbeo usus astrum strenuus usitas admoveo.?,2024-10-09 06:04:28.418
995,277,699,Volup aegrus tabula aliquid torrens adfectus audentia autem viriliter.?,2024-10-09 06:04:28.423
998,278,528,Nemo tendo valetudo undique cibus vulgo annus suscipio voro.?,2024-10-09 06:04:28.431
1000,278,615,Verbum uter temperantia sonitus thalassinus baiulus inflammatio cohibeo.?,2024-10-09 06:04:28.436
1002,279,540,Paulatim comminor comis.?,2024-10-09 06:04:28.442
1004,279,654,Eum libero atqui delibero cruentus nam vulariter.?,2024-10-09 06:04:28.447
1006,280,520,Tremo talis candidus absum crinis.?,2024-10-09 06:04:28.455
1008,280,703,Terga ago comis ter possimus.?,2024-10-09 06:04:28.460
1009,280,704,Similique itaque pectus celer aperio stipes certus defessus acidus.?,2024-10-09 06:04:28.462
1010,280,657,Nisi colligo ulterius error sonitus atque color ad.?,2024-10-09 06:04:28.465
1012,281,509,Totidem bellum bis earum.?,2024-10-09 06:04:28.471
964,271,556,Quod spoliatio vinitor.?,2024-10-09 06:04:28.329
966,272,520,Comminor tempus tristis defetiscor amplitudo conservo anser laborum fuga.?,2024-10-09 06:04:28.336
968,272,565,Coniecto nesciunt tabula ipsum non delego.?,2024-10-09 06:04:28.340
971,273,639,Quo quos odio votum totam abduco tero curvo vae.?,2024-10-09 06:04:28.351
972,273,673,Vaco cotidie arto spes temporibus pectus ancilla decerno.?,2024-10-09 06:04:28.355
975,273,509,Taceo vigor corrumpo maiores repudiandae conqueror.?,2024-10-09 06:04:28.362
977,274,535,Vestrum audeo ver.?,2024-10-09 06:04:28.368
979,274,547,Laborum venia arcus thymbra thermae corrupti sollers provident utor.?,2024-10-09 06:04:28.373
981,275,688,Vulnero saepe articulus aliqua.?,2024-10-09 06:04:28.381
983,275,520,Certe at corona volutabrum denuo.?,2024-10-09 06:04:28.387
984,275,686,Brevis beatae vinum apto trado.?,2024-10-09 06:04:28.389
987,276,607,Abduco alo deleniti viridis ager adsuesco tubineus comes odit.?,2024-10-09 06:04:28.399
988,276,639,Vobis abscido voluptates coniecto.?,2024-10-09 06:04:28.402
990,276,671,Aqua crux reiciendis verbum eveniet trucido summa curto ventito.?,2024-10-09 06:04:28.410
994,277,513,Tepidus aranea volo basium.?,2024-10-09 06:04:28.420
999,278,640,Venia succurro artificiose cohaero tenetur.?,2024-10-09 06:04:28.434
1005,279,665,Paens abduco creta.?,2024-10-09 06:04:28.449
1007,280,542,Tabgo civitas adhaero quo textus.?,2024-10-09 06:04:28.457
1014,281,571,Aspernatur vorax cupiditate derelinquo adversus vulariter terminatio arx.?,2024-10-09 06:04:28.476
986,276,585,Teneo quia cerno canis vir vitae abutor attollo subseco.?,2024-10-09 06:04:28.396
991,277,666,Quo pauci eos corrigo sub admiratio.?,2024-10-09 06:04:28.413
996,278,665,Velut tantum crebro tabula tremo ipsam annus solium.?,2024-10-09 06:04:28.426
997,278,530,Iusto vomer vacuus corrupti celer depopulo corporis paens.?,2024-10-09 06:04:28.429
1001,279,708,Comes contra asporto commodi confugo sopor tepesco.?,2024-10-09 06:04:28.439
1003,279,523,Nobis sint magnam.?,2024-10-09 06:04:28.445
1011,281,606,Colligo terga curo degenero venustas copia commodi alias benigne aiunt.?,2024-10-09 06:04:28.468
1013,281,585,Perspiciatis toties tenuis causa recusandae denuo conforto crudelis victoria.?,2024-10-09 06:04:28.473
1015,281,552,Titulus cariosus vinco ex virga tego compello ademptio succurro blanditiis.?,2024-10-09 06:04:28.478
